{
  "schemaVersion": 6,
  "profile": "complete-layer",
  "sourceRevision": 2,
  "screenUnit": "SCR-STORY-PROLOGUE:S0-STATE-KEY",
  "creationUnitCount": 1,
  "id": "BG-EXTERIOR-S0-CLOSED",
  "pipelineContract": "art-workspace/pipeline/pipeline-contract.json",
  "sourceMasterId": "CM-PROLOGUE-INHERITANCE-R1",
  "semanticOwner": "artist-2.s0-prologue-story",
  "assetMeaning": "S0-STATE-KEY의 중앙 대문이 완전히 닫힌 1920x1080 opaque exterior complete layer. KEY는 별도 PR-SHOP-KEY z40만 소비한다.",
  "approvalStatus": "approved-by-user",
  "runtimeRegistrationAllowed": false,
  "userApproval": {
    "status": "approved-by-user",
    "basis": "사용자가 pixel closed R2와 KEY FHD/720 계약 재조립을 승인했다.",
    "date": "2026-07-30"
  },
  "approvedCutout": {
    "status": "approved-by-user",
    "file": "../assets/bg-exterior-s0-closed-r2-pixel-fhd.png",
    "sha256": "504bc88e874a53e6a69e7dcfaad11cc949b654166d17815cae15a9948e67be21"
  },
  "spatialInference": {
    "file": "spatial-inference.json",
    "sha256": "b483338435f31c4c1d9194f8e499a69ab27782fd46ed6afc6638ce6612801bb5"
  },
  "measurements": {
    "width": 1920,
    "height": 1080,
    "transparencyMode": "opaque-full-frame",
    "transparentPixels": 0,
    "opaquePixels": 2073600,
    "partialAlphaPixels": 0
  },
  "outputs": {
    "completed": {
      "file": "assets/bg-exterior-s0-closed-r2-pixel-fhd.png",
      "sha256": "504bc88e874a53e6a69e7dcfaad11cc949b654166d17815cae15a9948e67be21"
    },
    "reviewBoard": {
      "file": "recomposition/recomposition-bg-exterior-s0-closed-fhd-r2.png",
      "sha256": "6db56ab95d8e914d1247e6db7f28dcec78bd5cb174ecab06a85eb563c27df23f"
    }
  },
  "rejectedIntermediate": {
    "retained": false
  }
}
